conversation_id_str,created_at,favorite_count,full_text,id_str,image_url,in_reply_to_screen_name,lang,location,quote_count,reply_count,retweet_count,tweet_url,user_id_str,username
1982812420780302554,Mon Oct 27 14:11:34 +0000 2025,0, Hal ini bisa menyebabkan berpindahnya cairan-cairan tubuh antara konsumen yang satu dengan yang lainnya kata Arini https://t.co/we8eg9TrH0,1982812420780302554,,,in,,0,0,0,https://x.com/undefined/status/1982812420780302554,18071520,
1982784785891160473,Mon Oct 27 12:21:45 +0000 2025,0,Purbaya Sikat Mafia Baju Bekas: Pelaku Thrifting Nolak Saya Tangkap Duluan! https://t.co/8sNUrEz0bc,1982784785891160473,,,in,,1,0,0,https://x.com/undefined/status/1982784785891160473,47274731,
1982773755387756963,Mon Oct 27 11:37:56 +0000 2025,29,gue kalau punya duit 30jt mau thrifting ke thailand sekalian mau anu lagian udah nikah ini gakan ada yang ngelarang (10jt buat baju) sisanya buat pp + hotel + jajan ,1982773755387756963,,,in,,0,3,0,https://x.com/undefined/status/1982773755387756963,335116442,
1982757413997646113,Mon Oct 27 10:33:00 +0000 2025,1,Menteri Keuangan Purbaya Yudhi Sadewa semakin serius berantas mafia impor baju bekas! Purbaya mengancam siapa pun pelaku thrifting ilegal yang menolak rencananya akan langsung ditangkap. #ImporBajuBekas #Purbaya #MafiaBalpres #EkonomiIndonesia https://t.co/NfKo3DUw2O https://t.co/v9fE6rbL47,1982757413997646113,https://pbs.twimg.com/media/G4QrW4eXEAAcVU7.jpg,,in,,0,0,1,https://x.com/undefined/status/1982757413997646113,1964554328649453576,
1982742016003035585,Mon Oct 27 09:31:48 +0000 2025,0,Tadi nyari baju thrifting di btm yah sue bajunya kecil semua WKWKWKWKWK. Akhirnya beli kemeja laki laki ,1982742016003035585,,,in,,1,1,0,https://x.com/undefined/status/1982742016003035585,201600218,
1982641404016046104,Mon Oct 27 08:32:04 +0000 2025,0,@Anggoro26028373 @tvOneNews Yang jadi soal baju thrifting ini tidak ada pajaknya. Dan sudsh pasti mematikan produsen textil lokal.,1982726980773851318,,Anggoro26028373,in,,0,0,0,https://x.com/undefined/status/1982726980773851318,2659188162,
1982707838100078767,Mon Oct 27 07:16:00 +0000 2025,4,Menteri Keuangan Purbaya Yudhi Sadewa berkomitmen melarang impor bal pakaian bekas. Penolakan akan ditindak tegas termasuk penangkapan pelaku ilegal. https://t.co/hc4eX6Xa3l,1982707838100078767,,,in,,1,1,1,https://x.com/undefined/status/1982707838100078767,69183155,
1982707838016496091,Mon Oct 27 07:16:00 +0000 2025,2,Menteri Keuangan Purbaya Yudhi Sadewa berkomitmen melarang impor bal pakaian bekas. Penolakan akan ditindak tegas termasuk penangkapan pelaku ilegal. https://t.co/6HWJq1EliX,1982707838016496091,,,in,,0,0,0,https://x.com/undefined/status/1982707838016496091,135795460,
1982703115720941735,Mon Oct 27 06:57:14 +0000 2025,0,siapa maw ikut acu thrifting baju buat konser cortis (gatau kapan konsernya tp),1982703115720941735,,,in,,0,7,0,https://x.com/undefined/status/1982703115720941735,1959294515963113472,
1982670005964824579,Mon Oct 27 04:45:40 +0000 2025,0,Bajunya bagus sih yg pasti ga pake baju thrifting lagi udh jadi madam ubon,1982670005964824579,,,in,,0,1,0,https://x.com/undefined/status/1982670005964824579,803655306,
1982453786020082028,Sun Oct 26 14:30:23 +0000 2025,1,Ada masanya dulu waktu masih di Bandung kalo gua butuh beli kemeja celana atau jaket gua cuma bisa thrifting ke Gedebage karena emg cuma punya sedikit baju/celana gua yang presentable buat kuliah (dan gapunya duit beli baru). Grgr influencer tbtb di Gedebage jadi mahal semua.,1982454766933590273,,finestposer,in,,0,0,0,https://x.com/undefined/status/1982454766933590273,185116995,
1982453786020082028,Sun Oct 26 14:26:29 +0000 2025,2,Yang menghancurkan UMKM bisa jadi memang baju murah impor china tapi yang menghancurkan thrifting jelas orang-orang/influencer tajir yang ikut-ikutan sambil NGEVLOG (kontol banget),1982453786020082028,,,in,,0,1,0,https://x.com/undefined/status/1982453786020082028,185116995,
1982356816509194307,Sun Oct 26 12:13:35 +0000 2025,2,@ARSIPAJA mending beli baju lokal murah daripada thrifting kw kan yaa ,1982420339729772610,,ARSIPAJA,in,,0,0,0,https://x.com/undefined/status/1982420339729772610,1800442416182468608,
1982408397535518832,Sun Oct 26 11:34:34 +0000 2025,0,bagus banget coo ini aplikasi buat yg suka thrifting. buat jual baju bekas sendiri juga bisa.,1982410522076311686,,meGYATwati,in,,0,1,0,https://x.com/undefined/status/1982410522076311686,1248274564074704896,
1981526516292079886,Sun Oct 26 09:37:21 +0000 2025,0,@rgoestama gw jg gatau knp org2 demen bgt thrifting baju,1982381023007780894,,rgoestama,in,,0,0,0,https://x.com/undefined/status/1982381023007780894,3316737703,
1981526516292079886,Sat Oct 25 15:26:23 +0000 2025,0,@rgoestama Ini juga krn ada pasarnya. Makanya gak usah lah beli beli thrifting anjir. Beli baju barulah sono. Lokalan juga banyak yg cakep murah. Heran ama indonesa,1982106473086992515,,rgoestama,in,,0,0,0,https://x.com/undefined/status/1982106473086992515,708688602,
1982051318891229328,Sat Oct 25 11:47:14 +0000 2025,0,Makin ke sini makin no no. Ga bermaksud gmn ya sama yg suka thrifting kita beda prinsip aja punten. Jadi kepikiran ini krn liat berita MenKeu mau negasin soal aturan import baju thrifting.,1982051323127419130,,savannah_conan,in,,0,0,0,https://x.com/undefined/status/1982051323127419130,608332643,
1982051318891229328,Sat Oct 25 11:47:13 +0000 2025,0,Idk bout other ppl. Tp kalo baju thrifting asli w ga bisa banget pake Dr kecil udahlah cukup pake baju lungsuran dr kaka² kandung ga lagi mau pake sisaan orang. Apalagi setelah SMA ya pake baju orang tu bs dihitung jari kalo terpaksa bgt baru deh pinjam.,1982051318891229328,,,in,,0,1,0,https://x.com/undefined/status/1982051318891229328,608332643,
1982038208037970003,Sat Oct 25 10:55:07 +0000 2025,2,Gue ngakak bgt beli baju thrifting di temen dah pede LD muat lupa nanya TB dia. Pas gue coba kok ni baju crop bgt busui friendly. TB gue 170-171. TB dia 148.,1982038208037970003,,,in,,0,2,0,https://x.com/undefined/status/1982038208037970003,1876423510500978688,
1982019379207569899,Sat Oct 25 09:40:19 +0000 2025,0,Pagi-pagi udah siap mau jalan ke Blok Em! Berpetualang mencari yang gemas-gemas! Thrifting baju dan makan jajanan viraalllll ala blok em Biar semangat aku dengerin lagu-lagu ini! Udah masuk di playlist! https://t.co/6L777Oyfmq,1982019382026064218,,JUUNhood,in,,0,0,0,https://x.com/undefined/status/1982019382026064218,1977689324704657409,
1981977561447252478,Sat Oct 25 08:17:49 +0000 2025,6,@fajarnugros Tembakan nya kena sasaran kemarin baju impor thrifting sekarang sawit... Udah tau masalah lapangan,1981998619634053190,,fajarnugros,in,,0,1,0,https://x.com/undefined/status/1981998619634053190,398798880,
1981992658995397106,Sat Oct 25 07:54:08 +0000 2025,0,Emang harusnya thrifting itu barangnya dari dalem negeri alias kita-kita aja. Ngapain jualin sampah negara maju? Makin rugi yang ada kita. Ini juga biar harga baju bekas beneran murah dan curated thrift kayak yang rame kemarin mikir kalo pasang harga.,1981992658995397106,,,in,,0,1,0,https://x.com/undefined/status/1981992658995397106,1362346775525289984,
1981526516292079886,Sat Oct 25 05:01:50 +0000 2025,0,@rgoestama Demi pake barang bermerk rela jadi penampungan sampah.. gua pernah ke pasar bekas gini dari setumpuk baju bekas paling yg oke cuma satu dua biji.. bekas yg bagusan mah masuk toko thrifting yg mahal. Bodoh bgt kata aku teh rela beli2 thrifting mahal ,1981949300151099576,,rgoestama,in,,0,1,0,https://x.com/undefined/status/1981949300151099576,1842929313018249217,
1981934344412529074,Sat Oct 25 04:19:22 +0000 2025,0,Kunci hoodie thrift itu berani coba dan bayangin styling-nya. Ini dia look hoodie barunya! Oversized gini nyaman banget buat daily wear. Thrifting itu bukan cuma soal hemat tapi soal nemuin baju yang punya cerita dan one of a kind. Sampai ketemu di thrift market berikutnya! https://t.co/bw8ceUC8rI,1981938613912052105,https://pbs.twimg.com/media/G4FCqoiXYAAn8dE.jpg,EUNSEOKhood,in,,0,0,0,https://x.com/undefined/status/1981938613912052105,1133422208296992768,
1981918211227750870,Sat Oct 25 03:55:35 +0000 2025,0,Eh ges mon maaf nih belanja bajunya ga kerekam btw dah ganti baju hasil thrifting nih. Makin gamteng yah gua https://t.co/X8aUP7sUct,1981932626589200735,https://pbs.twimg.com/media/G4E9NmiWgAAGLCn.jpg,NJMhood,in,,0,0,0,https://x.com/undefined/status/1981932626589200735,1570574972745289730,
1981259344638595560,Fri Oct 24 22:11:24 +0000 2025,1,@Melkha06 @noucampline Iya skrang ga beli thrifting tpi beli baju d ecommerce seharga 25-35rb yg ternyata brng impor. Ga smua orang ngeh itu prduk impor atau bkan kebanyakan liat murh ya gas aja. Balpres2 ini dah ada dri dulu jadi emang ribet mslah aturannya. Dibakar tetep ada yg masuk ada yg jual,1981846010008858723,,Melkha06,in,,0,1,0,https://x.com/undefined/status/1981846010008858723,1754353811865645056,
1981259344638595560,Fri Oct 24 15:19:24 +0000 2025,1,@LetsGoFarm62735 @dundunthetruth @noucampline Gak juga kak. Ada juga yg krna cinta lingkungan. Kaya aktivis malah nyaranin pakai baju smpe buluk atau beli thrifting krna fast fashion itu sangat merusak Bumi. Coba deh bka ig nya ceritanupi sama dinoaugusto mereka bahas hal ini scra mendalam,1981742328609194397,,LetsGoFarm62735,in,,0,0,1,https://x.com/undefined/status/1981742328609194397,340825585,
1981259344638595560,Fri Oct 24 15:16:21 +0000 2025,0,@JsqMalu8415 @noucampline Setuju bgt. Thrifting disalahin padahal yg minat jg gak banyak2 amat keliatan dri komenan netizen yg gak suka baju bekas. Masalahnya itu produk yang di impor dari China. Masyarakat suka dikecohin sama kebijakan kya gini,1981741557863841941,,JsqMalu8415,in,,0,1,0,https://x.com/undefined/status/1981741557863841941,340825585,
1981723548428165156,Fri Oct 24 14:04:47 +0000 2025,0,iyah ya suka ga nalar aku beli boneka rela wae. Giliran beli baju lebih suka thrifting atau gak convers diskonan di sport station. Yah abisan baju ma sepatu kan emang ada masanya diskon kalo skzoo mana ada ceritanya diskon yg ada untung2an nemu seller mabok/unstand,1981723548428165156,,,in,,0,1,0,https://x.com/undefined/status/1981723548428165156,1432981418297069571,
1981714807641510058,Fri Oct 24 13:30:03 +0000 2025,0,silakan saja kalo mau thrifting baju tapi jangan beli baju bekas hasil impor you kill your own brother by doing that pengen thrifting ya cari baju bekas yg emang dari awal dibikin dan dijual di indonesia sejak masih baru,1981714807641510058,,,in,,0,0,0,https://x.com/undefined/status/1981714807641510058,1075090106770309121,
1981687413379576308,Fri Oct 24 11:41:11 +0000 2025,1,setuju. market thrifting tu udah ga sehat. yg harusnya bisa dapat baju layak dg harga murah jatuhnha sekarang udah seharga beli baru bahkan lebih mahal.,1981687413379576308,,,in,,0,0,0,https://x.com/undefined/status/1981687413379576308,1312654758038048768,
1981636780890689677,Fri Oct 24 08:20:00 +0000 2025,3,Gubernur Jakarta Pramono dukung langkah pemerintah pusat berantas impor pakaian bekas. Dia mengatakan jual beli pakaian bekas itu merugikan. https://t.co/AbcfpICTpQ,1981636780890689677,,,in,,0,1,1,https://x.com/undefined/status/1981636780890689677,69183155,
1981526516292079886,Fri Oct 24 07:27:46 +0000 2025,2,@rgoestama Di negara maju baju thrifting ga begitu laku (kecuali kolektor) karena rakyatnya MAPAN dan punya kerjaan yang layak. Mereka mampu beli yang bagus buat apa beli bekas. Disini masih menunggu 19jt loker. Terkadang mau beli yang bagus kendala di harga.,1981623636306825286,,rgoestama,in,,0,0,0,https://x.com/undefined/status/1981623636306825286,1640376849254748162,
1981617252882690373,Fri Oct 24 07:02:24 +0000 2025,0,Sekalian barang dari china juga tutup pk. Karna kalo thrifting tu peminaatnya ga semua orang suka Tapi kalo cina baju baru harga murah semua orang kan mau ya jadi yaa kalo Mau barang dari china tutup jangan tanggunv tanggung,1981617252882690373,,,in,,0,0,0,https://x.com/undefined/status/1981617252882690373,1327922050275581953,
1981259344638595560,Fri Oct 24 05:17:10 +0000 2025,15,@noucampline Mereka ini udahlah beli bal murah dengan harga sampah sampe di Indonesia merusak market baju lokal dengan harga mahal sampe sampe gue lihat baju produksi lokal tuh dibuat murah anjirt tetap aja yg menang baju thrifting live harga 100k keatas,1981590768537227526,,noucampline,in,,0,1,0,https://x.com/undefined/status/1981590768537227526,1441249547099934722,
1981526516292079886,Fri Oct 24 04:23:04 +0000 2025,1,@rgoestama Di syopi live tuh banyak toko jualan baju thrifting,1981577155231252913,,rgoestama,in,,0,0,0,https://x.com/undefined/status/1981577155231252913,1529083005561864192,
1981526516292079886,Fri Oct 24 03:59:27 +0000 2025,0,@rgoestama Pernah nemuin bungkusan kondom di saku baju thrifting yang di jual,1981571214184529983,,rgoestama,in,,0,0,0,https://x.com/undefined/status/1981571214184529983,1091541196659318784,
1981553018773655612,Fri Oct 24 02:47:09 +0000 2025,6,Sumpah temen kerja aku tiap hari kecanduan nonton live thrifting gini masalahnya beli baju bukan buat kebutuhan lagi tapi udah ditahap kecanduan udah kek orang main judol kecanduannya ,1981553018773655612,,,in,,0,3,0,https://x.com/undefined/status/1981553018773655612,1478070463305641985,
1981259344638595560,Fri Oct 24 02:43:45 +0000 2025,0,@honeydewsummer @noucampline Namanya juga baru wacana bertahap bos. Semoga thrifting baju dulu terus bertahap barang lainnya.,1981552160212210022,,honeydewsummer,in,,0,1,0,https://x.com/undefined/status/1981552160212210022,1195357776098156544,
1981551174961811970,Fri Oct 24 02:39:50 +0000 2025,0,Haruskah aku frugal living lagi? Tiba2 pengen thrifting padahal kemaren kepikiran ngirim baju ke rumah. Ga boleh ya fat ga baik kaya gitu,1981551174961811970,,,in,,0,0,0,https://x.com/undefined/status/1981551174961811970,347030921,
1981524679660884153,Fri Oct 24 02:28:45 +0000 2025,12,@el_jastip Mungkin udah pada jadi wirausaha thrifting semua Bang... Lagian konsep thrifting di sini malah jualan baju bekas impor. Dimana-mana thrifting mah jualan baju layak pakai hasil donasi lokalan. Emang ngawur sengklek warga dimarih. Sama kek pemerintahnya,1981548387947466869,,el_jastip,in,,0,2,0,https://x.com/undefined/status/1981548387947466869,500705112,
1981259344638595560,Fri Oct 24 01:38:12 +0000 2025,10,@noucampline Lagian apa enaknya thrifting sih? Aku pernah di ajak temenku thrifting beli 1x karna suka bajunya habis itu gk mau lg karna selain ribet harus nyuci berkali-kali aku jg mikir dg harga segitu (35k) bisa dapet baju baru bagus di toko online setelah itu gk mau lg thrifting,1981535666615046167,,noucampline,in,,1,2,0,https://x.com/undefined/status/1981535666615046167,1075989101310967810,
1981529069465588033,Fri Oct 24 01:11:59 +0000 2025,1,Fyi aja tiap bazar cfd minggu setiap tenant yang selalu rame pasti thrifting yg jual baju-celana mulai 10rb-35rb omset bisa 2-3jtaan/hari minggu. pedagang baju baru-fashion? Kalah telak omset bisa 1jt aja bersyukur pisan.,1981529069465588033,,,in,,0,0,0,https://x.com/undefined/status/1981529069465588033,98015092,
1981528891715186801,Fri Oct 24 01:11:17 +0000 2025,1,Padahal baju² lokal di Indo sekarang udh lumayan² Ga pernah thrifting karena gue anaknya jijikan. I know sound so pick me tapi kita gatau noh riwayat yg pake sebelumnya baju baru di toko aja w rendem dulu di cuci sebelum di pake,1981528891715186801,,,in,,0,0,0,https://x.com/undefined/status/1981528891715186801,335134024,
1981259344638595560,Thu Oct 23 15:45:42 +0000 2025,6,@noucampline Jujur market thrifting ini meresahkan sih. Suka heran liat orang2 pada suka beli baju di situ apa gak takut gitu lohh,1981386558734553582,,noucampline,in,,0,1,0,https://x.com/undefined/status/1981386558734553582,742749861892624386,
1981332519971934638,Thu Oct 23 12:17:39 +0000 2025,0,? Seharian ini super gabut terus tiba-tiba kepikiran deh ???????????????? ???????? ?????????? ???????????? ???????? ???????????????? ??????????????. So I call Sean buat thrifting dan styling baju buat hari ini! ?,1981334201875227082,,starletasa,in,,0,1,0,https://x.com/undefined/status/1981334201875227082,1895516532287102977,
1981320797718503625,Thu Oct 23 11:24:23 +0000 2025,1,Nggak cuma sekadar teguran Menkeu Purbaya Yudhi Sadewa bilang kalau pelaku impor baju bekas bakal diblacklist alias nggak boleh impor lagi. Terus gimana nasib Pasar Senen pusat thrifting legendaris di Jakarta? Yuk kita spill dikit. Produser | Naskah: Oci VO | Admin: Oci https://t.co/gOb084QH0A,1981320797718503625,https://pbs.twimg.com/amplify_video_thumb/1981317679785873408/img/C8nJ8zarP0a2tMPi.jpg,,in,,0,0,0,https://x.com/undefined/status/1981320797718503625,502140136,
1981188492874207732,Thu Oct 23 10:52:26 +0000 2025,0,@martinkeonho vlog thrifting baju di blok m harga under 100k aje,1981312754045899058,,martinkeonho,in,,0,1,0,https://x.com/undefined/status/1981312754045899058,1967100384738205696,
1981301205482811567,Thu Oct 23 10:14:20 +0000 2025,0,@starletsean BOLEH DD! Kita bikin konten a day in my life thrifting dan styling baju. Kalau ideku sih tadinya 'pilihin baju' dengan specific themed gituu. Tapi kayaknya lebih seru styling baju saru sama lain deh :3,1981303168471617803,,starletsean,in,,0,1,0,https://x.com/undefined/status/1981303168471617803,1895516532287102977,
1981283249445097978,Thu Oct 23 08:55:11 +0000 2025,0,pengen thrifting baju deh..,1981283249445097978,,,in,,0,0,0,https://x.com/undefined/status/1981283249445097978,1327950231556681728,
1980890865687212148,Thu Oct 23 06:28:09 +0000 2025,2,@adohnggone @detikcom Udah lama gak ngetrift. Baju thrifting lama-lama harganya nggak ngotak.,1981246247702057133,,adohnggone,in,,0,0,0,https://x.com/undefined/status/1981246247702057133,203174968,
1981224065701495162,Thu Oct 23 05:00:01 +0000 2025,4,Menkeu Purbaya Yudhi Sadewa merespons dampak pelarangan impor bal pakaian bekas dalam karung atau balpres terhadap bisnis di Pasar Senen. &gt;&gt; https://t.co/eMSaGm5p44 #Thrifting #PasarSenen #PurbayaYudhiSadewa #BajuBekas #Impor #Ilegal https://t.co/HbeiZ0f3hP,1981224065701495162,https://pbs.twimg.com/media/G33hoYRXkAA1O3D.jpg,,in,,0,0,0,https://x.com/undefined/status/1981224065701495162,135795460,
1981210731195633735,Thu Oct 23 04:07:02 +0000 2025,20,Menkeu sedang membidik impor dan selundupan tekstil Salah satunya adalah impor pakaian bekas aka thrifting Pengguna pakaian bekas ini mungkin saking terbuai dgn harga murah (dpt baju dgn harga 5-25 ribu perak per pieces) tapi praktek ini merugikan negara 6 2 T dr sisi pajak https://t.co/bVdK29Efxo,1981210731195633735,https://pbs.twimg.com/ext_tw_video_thumb/1981210659544088577/pu/img/n2TxrueqjZZ45h-4.jpg,,in,,0,7,9,https://x.com/undefined/status/1981210731195633735,1152447574411902977,
1981052630907703636,Wed Oct 22 18:24:30 +0000 2025,0,dan inilah hasil thrifting outfit andalan GW. kaos yang ada kode qrisnya. jadi buat yang mau tf ke gw boleh kok langsung scan aja baju gw tapi ketambahan admin qris 100k/transaksi ya. trims https://t.co/GLn1038GFA,1981064133689954578,https://pbs.twimg.com/media/G34nVJrXcAAWjZr.jpg,TAESANhood,in,,0,1,0,https://x.com/undefined/status/1981064133689954578,3235900610,
1980976799460040941,Wed Oct 22 12:45:24 +0000 2025,175,sangwon ngajakin si anak orang kaya ini main ke blok m panas panasan thrifting baju di pasar senen keliling pasar santa buat liat aksesori lucu dan ke toko buku bekas buat beli bacaan baru. aku bisa beliin kamu yang baru thrift gini kita gak tau ini baju bekas siapa kan. ,1980978797831983615,,luthienar,in,,1,1,1,https://x.com/undefined/status/1980978797831983615,1279128281795592192,
1980288357956808942,Wed Oct 22 08:12:57 +0000 2025,0,@txtdarionlshop Kemarin iseng thrifting store isinya baju2 proloved serupa baju2 HnM zara dkk harganya cuma 25 - 50 ribuan aja. Ya aku mending thrifting lah daripada beli baju model sama harga ratusan ribu,1980910230939791406,,txtdarionlshop,in,,0,0,0,https://x.com/undefined/status/1980910230939791406,460881913,
1980895898981826624,Wed Oct 22 07:16:00 +0000 2025,4,Menteri Keuangan Purbaya Yudhi Sadewa menegaskan larangan impor bal pakaian bekas tidak akan tutup Pasar Senen. Begini katanya.https://t.co/tpR6WlG9dt,1980895898981826624,,,in,,0,1,3,https://x.com/undefined/status/1980895898981826624,69183155,
1980890865645113381,Wed Oct 22 06:56:00 +0000 2025,0,Menteri Keuangan Purbaya Yudhi Sadewa menegaskan larangan impor bal pakaian bekas tidak akan tutup Pasar Senen. Begini katanya. https://t.co/eMSaGm5p44,1980890865645113381,,,in,,0,0,0,https://x.com/undefined/status/1980890865645113381,135795460,
1980656940448649691,Tue Oct 21 15:26:28 +0000 2025,2,Mim emo girl yang kalo beli baju sama accessories belinya thrifting,1980656940448649691,,,in,,0,0,0,https://x.com/undefined/status/1980656940448649691,3471119594,
1980652164868632649,Tue Oct 21 15:07:29 +0000 2025,0,pls anyone ajak aku thrifting sblm aku makin banyak beli baju thrift MAHAL di ig,1980652164868632649,,,in,,0,0,0,https://x.com/undefined/status/1980652164868632649,1537771380720033792,
1980641591883890917,Tue Oct 21 14:35:05 +0000 2025,0,@starletminju Besok harus bekerja mencari baju thrifting jadi harus tidur,1980644013222031475,,starletminju,in,,0,1,0,https://x.com/undefined/status/1980644013222031475,1895385907567747072,
1980622851276484685,Tue Oct 21 13:11:00 +0000 2025,0,thrifting 3 baju gocap dapet item sikrit alias kece jir,1980622851276484685,,,in,,0,3,0,https://x.com/undefined/status/1980622851276484685,1936037415199895552,
1980499126807879703,Tue Oct 21 04:59:22 +0000 2025,0,Guys baju2ku itu smua preloved pemakaian pribadi gada baju yg thrifting yahh ...,1980499126807879703,,,in,,0,0,0,https://x.com/undefined/status/1980499126807879703,1464949653833588736,
1980420084800844136,Mon Oct 20 23:45:17 +0000 2025,0,abis minggu2 midterm test siapa yg mau nemenin gue thrifting baju? ,1980420084800844136,,,in,,0,1,0,https://x.com/undefined/status/1980420084800844136,1796149268430106624,
1980317460088737793,Mon Oct 20 16:57:29 +0000 2025,8,pad! Info thrifting baju buat di jual kembali. Di daerah Jatinangor/Bandung. thanks,1980317460088737793,,,in,,0,14,0,https://x.com/undefined/status/1980317460088737793,1734036638605733888,
1980223924282839266,Mon Oct 20 10:45:48 +0000 2025,0,Zuzurrr in this economy aku lebih suka thrifting baju/rok dg harga dibawah 50rb. Seriuss deh kalau pinter milihnya bakalan dapat model yang cakep2 timeless dan murah 100k bisa dpat buanyakkk baju ??,1980223924282839266,,,in,,0,0,0,https://x.com/undefined/status/1980223924282839266,464420940,
1980217620059341076,Mon Oct 20 10:20:45 +0000 2025,0,ini sering banget di Indo. Mulai dari baju thrifting sampai mobil bekas mobil bekas rare limited edition itu mobil rare karena pas dijual kaga ada yang mau beli bambang,1980217620059341076,,,in,,0,0,0,https://x.com/undefined/status/1980217620059341076,705177234,
1979917402901979240,Mon Oct 20 02:54:18 +0000 2025,0,@ditoks Sama thrifting baju 20 rebuan udah dapet baju mirip zara,1980105266764116174,,ditoks,in,,0,0,0,https://x.com/undefined/status/1980105266764116174,460881913,
1979891497035342075,Sun Oct 19 12:44:52 +0000 2025,3,pad!! disini siapa yang mau beli baju Thrifting disini aku jual ya baju Thrifting by amamel harga murce murce kalau minat boleh chet WA ini 0895-7061-90025 https://t.co/7WWSlYnL2n,1979891497035342075,https://pbs.twimg.com/media/G3n8wl6bEAAKL1W.jpg,,in,,0,1,0,https://x.com/undefined/status/1979891497035342075,1734036638605733888,
1979842055187947843,Sun Oct 19 10:17:47 +0000 2025,0,@starlettaesan Bang coba bagi tips gimana bisa dapet baju thrifting seharga 10 ribu tapi like a new? (butuh banget) :',1979854482797474227,,starlettaesan,in,,0,1,0,https://x.com/undefined/status/1979854482797474227,3553845132,
1979532341220700646,Sat Oct 18 12:57:42 +0000 2025,0,ini nilai to apa harga baju thrifting yak 45 :V,1979532341220700646,,,in,,0,0,0,https://x.com/undefined/status/1979532341220700646,1693519796678406144,
1979492389464264916,Sat Oct 18 10:18:57 +0000 2025,0,thrifting apaan jir 850k BUAT BAJU BEKAS gila,1979492389464264916,,,in,,0,0,0,https://x.com/undefined/status/1979492389464264916,1644390607337689089,
1979455795390746731,Sat Oct 18 07:53:32 +0000 2025,0,kemaren liat baju RHCP stonewash di thrifting nyesel gak berenti terus beli tuh baju,1979455795390746731,,,in,,0,0,0,https://x.com/undefined/status/1979455795390746731,1944680951579316224,
1940326694952608017,Sat Oct 18 03:15:25 +0000 2025,0,Panduan berbelanja baju vintage Lengkap dengan contoh dipakai + stylingnya. Kalaupun kamu bukan penyuka thrifting cara kakaknya try on baju tetep enak bgt buat disimak. https://t.co/DfV55bt2kT,1979385802351366576,,liriopebee,in,,0,0,0,https://x.com/undefined/status/1979385802351366576,75564399,
1979142917731110997,Fri Oct 17 13:30:46 +0000 2025,2,@al_ijbol ini mah adriana lima masih dagang baju thrifting di pasar santa,1979178272496796124,,al_ijbol,in,,0,0,0,https://x.com/undefined/status/1979178272496796124,1825055178887966720,
1979063632710234380,Fri Oct 17 09:01:25 +0000 2025,0,@TamagoPost ? ?? Cecilia 2002. You suka thrifting nggak? Kalo suka nanti i ajak ke tempat biasa i cari baju. ? ??,1979110491005022307,,TamagoPost,in,,0,0,0,https://x.com/undefined/status/1979110491005022307,2376741084,
1979056755301552635,Fri Oct 17 05:51:23 +0000 2025,0,@Bubaks___ Kemaren katanya mau jualan baju thrifting gak jadi? Kayaknya cocok juga buat Anita.,1979062667764732182,,Bubaks___,in,,0,1,0,https://x.com/undefined/status/1979062667764732182,25065219,
1978996215363584198,Fri Oct 17 01:27:20 +0000 2025,0,kek warlok yang lagi thrifting baju di pasar malem https://t.co/UrS8iY7SDW,1978996215363584198,https://pbs.twimg.com/media/G3bOj-YWkAEdlm1.jpg,,in,,0,0,0,https://x.com/undefined/status/1978996215363584198,2210152423,
1978812312501747795,Thu Oct 16 13:16:34 +0000 2025,0,Temen gue ada yg baju resepsinya hasil thrifting.... HMMMMMM MENARIK,1978812312501747795,,,in,,0,1,0,https://x.com/undefined/status/1978812312501747795,101614860,
